{
  "id": "merchant_guild_intro",
  "world_id": "wha_au",
  "name": "A Merchant's Favour",
  "description": "The Merchant Guild's local factor has lost a shipment to bandits along the Thornveil Road. Recover the crates and earn the Guild's gratitude.",
  "giver_npc_id": "halvric_factor",
  "region_id": "thornveil_lowlands",
  "level_requirement": 1,
  "objectives": [
    { "id": "find_crates", "description": "Locate the overturned wagon on the Thornveil Road." },
    { "id": "defeat_bandits", "description": "Deal with the bandits guarding the stolen goods." },
    { "id": "return_crates", "description": "Return the shipment crates to the factor." }
  ],
  "rewards": {
    "currency": 30,
    "faction_standing": { "merchant_guild": 10 },
    "experience_flag": true
  },
  "flags_on_complete": ["merchant_guild_intro_done"]
}
